{
  "repair_plan_type": "ADMISSORIUM_DRY_RUN_PROJECTION_REPAIR_PLAN",
  "schema_version": "1.0.0",
  "truth_warning": "NOT_TRUTH_SOURCE",
  "repo": "Verifrax/VERIFRAX-DOCS",
  "allowed": true,
  "mode": "DRY_RUN_ONLY",
  "truth_path_touched": false,
  "protected_path_touched": false,
  "projection_only_assertion": true,
  "files_to_change": [
    "README.md",
    "docs/role-boundary.md"
  ],
  "forbidden_files_confirmed_absent": [
    "law/**",
    "current/**",
    "epochs/current/**",
    "authorities/current/**",
    "receipts/current/**",
    "verification/results/current/**",
    "recognitions/current/**",
    "recourse/current/**"
  ],
  "diff_sha256": "sha256:fixture",
  "requires_human_review": true
}
